,Date,News
638,2016-08-09,Sri Lankan rupee trades steady; stocks little changed
639,2016-08-09,Deutsche Bank Sec. fined USD12.5 mln for inadequate communication supervision
640,2016-08-09,"Asia shares up as yield hunt drives record flows, pound slips"
641,2016-08-08,"Norges wealth fund increases stake in Dialog, EPF reduces"
642,2016-08-06,Sri Lanka foreign reserves at USD6.5bn by end July: Central Bank
643,2016-08-05,Sri Lankan shares rise as investors pick blue chips; rupee steady
644,2016-08-05,Colombo Stock Exchange offers online services through CDS e-connect
645,2016-08-05,"Asia gains on BoE easing boon, key US jobs data awaited"
646,2016-08-04,Sri Lankan rupee up on bond buying by foreigners; spot starts trading
647,2016-08-04,JB Vantage wins Sri Lanka CFA’s top Unit Trust award
648,2016-08-04,"BoE rate call looms, Asian shares firm as oil rebounds for now"
649,2016-08-02,"Asian shares subdued, RBA rate decision awaited"
650,2016-08-01,GAAM: Foreign inflow of Rs207 mln to CSE during week
651,2016-08-01,Sri Lanka has demand for higher yielding financial instruments: Nandalal
652,2016-08-01,Sri Lankan rupee steady in dull trade; bond holders book profit
653,2016-07-29,"Asian shares flat, yen hits 2-week high ahead of BOJ"
654,2016-07-28,Sri Lanka’s Central Bank increases policy rates by 50bps
655,2016-07-28,Sri Lanka rupee up on bank dlr sales; c.bank rate decision eyed
656,2016-07-27,Sri Lankan rupee edges down on importer dollar demand
657,2016-07-27,"Asian shares edge up on Wall Street lead, pre-Fed nerves limit gains"
658,2016-07-26,POLL: Sri Lanka Central Bank expected to keep policy rates steady
659,2016-07-26,Sri Lankan rupee steady; exporter dollar sales offset importer demand
660,2016-07-25,Sri Lankan rupee edges up on bank dollar sales; stocks slip
661,2016-07-23,Sri Lanka Mackwoods Chairman responds to SEC’s directive
662,2016-07-22,Sri Lankan rupee gains on dollar selling by state bank; stocks up
663,2016-07-22,U.S. investors prefer real estate and cash to stocks: survey
664,2016-07-22,Sri Lanka’s Amana Takaful Life Rs75 Mln IPO oversubscribed
665,2016-07-21,Sri Lanka consumer prices NCPI soars 6.4-pct in June
666,2016-07-21,Sri Lankan rupee edges up on dollar sales by state bank
667,2016-07-20,SEC blocks sale of Agalawatte Plantation shares in directive
668,2016-07-20,Sri Lankan rupee falls on importer dollar demand; stocks up
669,2016-07-13,Sri Lankan rupee firms on dollar selling by foreign bank; stocks rise
670,2016-07-12,"Sri Lanka’s sovereign bond orders hit USD5.5 bln, govt raises USD1.5 bln (Updated)"
671,2016-07-11,Sri Lanka’s sovereign bond orders top USD4.5 bln: source
672,2016-07-11,"Asia stocks rally on US jobs relief, BoE looms"
673,2016-07-08,"Asia stocks steady, look to US jobs to soothe Brexit anxiety"
674,2016-07-07,"Asia stocks bounce, upbeat U.S. data soothes nerves"
675,2016-07-05,Asian shares slide as investors ponder stimulus outlook
676,2016-07-05,"Asia shares fall, bonds surge as Brexit fears resurface"
677,2016-07-04,"Asian stocks recoup losses, Aussie wobbles on uncertain election"
678,2016-07-01,Sri Lanka faces huge debt service requirements by July & Sept
679,2016-07-01,"Asia stocks rise as risk appetite recovers, pound under fresh pressure"
680,2016-06-30,"FTSE recovers Brexit losses, Brent crude down 1.2-pct"
681,2016-06-28,Sri Lanka’s Amana Takaful Life announces IPO of Rs75Mn
682,2016-06-28,"Brexit vote, UK political confusion keep world and asian markets on edge"
683,2016-06-24,Sri Lanka’s Central Bank keeps policy rates steady
684,2016-06-24,Sri Lanka CB Governor won’t seek reappointment until probe over
685,2016-06-23,"Asia stocks, sterling rise as Brexit anxiety abates"
686,2016-06-22,"Oil prices above USD50, buoyed by U.S. stock draw"
687,2016-06-22,"Opportunities for value investors, rate hikes limited: JB Securities"
688,2016-06-22,Sri Lankan rupee 1-wk forwards fall on importer dollar demand; stocks slip
689,2016-06-21,"Sri Lanka’s debt higher than B, BB rated countries, Fitch data shows"
690,2016-06-21,"Asia shares pause, sterling stands tall as Brexit vote looms"
691,2016-06-20,Sri Lankan rupee 1-wk forwards weaker on importer dlr demand
692,2016-06-20,"Asia stocks gain as Brexit fears ebb slightly, pound surges"
693,2016-06-17,"Asian shares face weekly losses, sterling rebounds in Brexit turmoil"
694,2016-06-16,Sri Lanka CDS to introduce electronic voting and IPO facility this year
695,2016-06-16,"Global treasuries plunge on Brexit, safe haven demand"
696,2016-06-15,"Sri Lanka promises to reform Airline, public sector, fuel pricing to IMF"
697,2016-06-15,"China’s yuan hits weakest in more than 5 yrs after PBOC fix, MSCI disappointment"
698,2016-06-14,"Oil futures fall as global growth, Brexit concerns weigh"
699,2016-06-13,"Bitcoin hits 2-year high, now 684.78 on Chinese buying"
700,2016-06-13,Brexit vote won’t favor risk assets: Gross
701,2016-06-13,"Asian shares and sterling skid, yen firms"
702,2016-06-08,"Asian shares at near six week high on oil, Fed expectations"
703,2016-06-07,Asia stocks hit 5-week high after cautious Yellen
704,2016-06-06,"Asian shares rise, dollar nurses losses after jobs shock"
705,2016-06-04,IMF approves 36-month EFF facility of USD1.5 Bln to Sri Lanka
706,2016-06-03,"Ethics crucial to business, says SEC Chairman Karunaratne"
707,2016-05-27,"SL Funds: Equity Unit Trusts now outperform market, says Guardian Acuity"
708,2016-05-26,Possible misappropriation of Rights Issue funds in Blue Diamonds: E&Y
709,2016-05-26,"Sri Lanka’s John Keells Holdings net down 13-pct in 4Q, revenues flat"
710,2016-05-25,Sri Lanka’s Hayleys net up 49-pct in March 2016 quarter
711,2016-05-24,Sri Lanka’s John Keells Holdings to subdivide ordinary shares
712,2016-05-19,Ravi K says Japan agrees USD2.5bn development loan to Sri Lanka
713,2016-05-17,Sri Lanka’s Hayleys to raise Rs2bn in listed debt
714,2016-05-13,Equity crowdfunding soon for average investors in US
715,2016-05-09,SEC imposes restrictions on Entrust Capital Markets activities
716,2016-05-04,Sri Lanka to raise USD500 mln through syndicated loan: Governor
717,2016-05-04,Chevron plans to expand local and regional presence
718,2016-05-04,CSE to change methodology to calculate price multiples
719,2016-04-26,"Sri Lanka budget deficit climbs, economy at USD82.3 billion"
720,2016-04-26,Sri Lanka holds rates unchanged after policy meeting
721,2016-04-18,Central Bank sees monetary policy stance as appropriate
722,2016-04-12,"Sri Lanka economy adjusting, may receive USD1-1.25 bln from IMF: CB"
723,2016-04-11,Ceylon Dollar Bond Fund records 8.82 percent dollar return
724,2016-04-07,Sri Lanka to sign MOU with China to enhance market liquidity
725,2016-04-07,We don’t want to see companies getting delisted: Securities Regulator
726,2016-04-06,S&P and CSE Sector and Industry Group Indices launched
727,2016-04-04,SEC to engage listed companies on Minimum Public Float
728,2016-03-30,Sri Lanka plans to issue up to USD3 bln in international sovereign bonds
729,2016-03-29,Sri Lanka rates held unchanged after monetary policy meeting
730,2016-03-29,CSE seeks foreign listings on proposed dollar denominated Board
731,2016-03-24,Prime Minister orders an investigation into CSE power failure
732,2016-03-23,Markets mixed after deadly attacks in Brussels
733,2016-03-21,CSE Wins Global HR Excellence Award
734,2016-03-18,"Investment Summit: Sri Lanka bonds attractive in Asia, say officials"
735,2016-03-16,Sri Lanka foreign reserves at USD6.6bn; IMF support by mid 2016
736,2016-03-12,Sri Lanka Investment Summit to kick off in Singapore
737,2016-03-10,Sri Lanka stocks close up 1.5-pct; Continued  foreign in-flow
738,2016-03-09,"Sri Lanka stocks close down 1.2-pct, foreign inflow 602 mln rupees "
739,2016-03-08,Sri Lanka stocks close down 2-pct at near two year low
740,2016-03-04,Sri Lanka stocks close lower 0.06-pct
741,2016-03-04,"Sri Lanka exports, imports declines; trade gap widens in December 2015"
742,2016-03-03,Sri Lanka’s stock exchange launches educational web portal
743,2016-03-02,Singer Sri Lanka to raise Rs2bn in listed debt
744,2016-02-29,"Popular international stocks take a beating, say analysts"
745,2016-02-29,Investrust says its money market fund outperformed in 2015
746,2016-02-29,Sri Lanka to go to markets after IMF meetings
747,2016-02-26,Capital gains tax may kill stock market: Ravi Abeysuriya
748,2016-02-26,"Sri Lanka no longer a poor country, discussions with IMF constructive: CB Governor"
749,2016-02-25,Sri Lanka wants to maintain rates at current levels: CB Governor
750,2016-02-25,SEC reconsiders minimum public float rule: CSE
751,2016-02-25,Emerging markets offer long-term opportunity: Research Affiliates
752,2016-02-24,Sri Lanka stocks down 0.2-pct 
753,2016-02-19,Sri Lanka stocks up 0.7-pct
754,2016-02-18,Sri Lanka’s Orient Finance IPO backed by Janashakthi  
755,2016-02-18,Crowdfunding platform Crowdisland.lk launched for Sri Lankan start ups
756,2016-02-17,Sri Lanka stocks close down 0.5-pct
757,2016-02-17,Norges Bank increases shareholding in Dialog Axiata
758,2016-02-16,Sri Lanka stocks close down 0.2-pct
759,2016-02-16,New capital adequacy requirements for stockbrokers: CSE
760,2016-02-16,"Global stocks rebound, eyes on Saudi, Russia Oil meeting"
761,2016-02-15,Sri Lanka stocks close down 0.3-pct; Continued foreign outflow
762,2016-02-15,China stocks open lower with equities in bear market
763,2016-02-11,Sri Lanka CSE calls proposals for CCP suppliers   
764,2016-02-09,"Nikkei falls 5 pct on negative interest rates, global growth"
765,2016-02-05,IMF urges Sri Lanka govt to narrow fiscal deficit
766,2016-02-05,Colombo Stock Exchange CDS partners with LankaPay
767,2016-01-29,Sri Lanka stocks close up 0.3-pct; Low investor activity
768,2016-01-28,Sri Lanka stocks close higher 0.05-pct
769,2016-01-26,Sri Lanka stocks closed down 0.5-pct
770,2016-01-26,Orient Finance IPO raises Rs987 mln on opening day
771,2016-01-25,Sri Lanka Monetary Board holds key rates unchanged
772,2016-01-25,Sri Lanka stocks closed down 0.4-pct; Turnover at near 4 week low
773,2016-01-21,Sri Lanka stocks closed up 1.6-pct
774,2016-01-21,Asia Securities estimates 5-6 percent GDP growth and 3-pct inflation in 2016
775,2016-01-20,Sri Lanka stocks closed down 0.3-pct
776,2016-01-20,Interview: Attractive returns on Sri Lanka bonds due to volatility
777,2016-01-18,Tony Weerasinghe launches online retail brokerage Ustocktrade
778,2016-01-17,Sri Lanka stocks down 1.9-pct; 18 month low
779,2016-01-14,CCP by first quarter 2017: CSE Chairman
780,2016-01-13,Sri Lanka stocks up after 7 days of losses; bargain hunting
781,2016-01-12,Sri Lanka stocks close with highest intra-day loss in 5 months    
782,2016-01-12,Medium term growth prospects for Sri Lanka market: CT CLSA
783,2016-01-12,"An investor to park USD1 bln in dollar deposits, says Finance Minister"
784,2016-01-11,SEC advises TKS Securities over possible violation of rules
785,2016-01-08,Sri Lanka stocks close down 0.7-pct
786,2016-01-07,Sri Lanka stocks close at 18-month low
787,2016-01-07,"Anemic EM weigh on global growth, South Asia a bright spot: World Bank"
788,2016-01-07,"Global equities off to poor start, Brent crude at 11-year low"
789,2016-01-06,Sri Lanka stocks close down 0.4-pct: Foreign participation 83-pct  
790,2016-01-06,Sri Lanka’s Orient Finance to raise Rs1bn through IPO
791,2016-01-06,CSE obtains exchange control approval to list foreign companies
792,2016-01-06,HNB Grameen shares to be listed in CSE
793,2016-01-06,"Sri Lanka, Pakistan consider currency swap agreement"
794,2016-01-05,Sri Lanka stocks close down 0.3-pct
795,2016-01-05,Foreign funds overweight on India bonds
796,2016-01-05,"US, European markets tumble after China rout"
797,2016-01-01,"Sri Lanka interest rates tied to inflation, Fed: CB Governor"
798,2015-12-31,Sri Lanka’s CSE removes share transaction levy
799,2015-12-31,Sri Lanka stocks close up 0.3-pct
800,2015-12-31,Sri Lanka economy grew 5.2 pct in first nine months : CB-Updated
801,2015-12-30,"Sri Lanka Central Bank tightens monetary policy, increases SRR"
802,2015-12-30,Sri Lanka stocks close up 0.3-pct
803,2015-12-29,Rs50 bln in bonds likely privately placed by Sri Lanka Central Bank
804,2015-12-29,"PTL Watch: Bit of buying, monetary policy awaited"
805,2015-12-28,Turnaround in int’l tech IPOs possible in 2016
806,2015-12-23,Sri Lanka stocks close higher 0.06-pct
807,2015-12-22,Sri Lanka stocks close down 0.4-pct: 21 month low
808,2015-12-21,Sri Lanka stocks close lower 0.04-pct: Five month low  
809,2015-12-17,Sri Lanka requests India to extend USD 1.5bn swap facility by one year
810,2015-12-17,We are not dictated by IMF policy: Finance Minister
811,2015-12-16,S&P Dow Jones announces changes in S&P Sri Lanka 20 index
812,2015-12-15,Fed liftoff largely priced in by emerging markets: ABN AMRO
813,2015-12-11,"Sri Lanka stocks close up 0.1-pct, high institutional activity"
814,2015-12-11,"Sri Lanka * market update * Asian markets mixed, Brent 39.47; CTHR traded"
815,2015-12-10,Sri Lanka stocks close down 0.3-pct:Turnover high
816,2015-12-09,Sri Lanka stocks close down 0.1-pct: Eight and a half month low
817,2015-12-09,Sri Lanka has borrowings of USD1.5 bln in pipeline for next year
818,2015-12-09,"Sri Lanka well placed with end of war, new infrastructure: IMF’s Kvintradze"
819,2015-12-08,Sri Lanka stocks close down 0.1-pct  
820,2015-12-07,Sri Lanka stocks close down 0.2-pct: Low investor activity   
821,2015-12-07,"Debt Report: Thin activity in Sri Lanka markets, liquidity surplus dips"
822,2015-12-07,FCID arrests Nalaka Godahewa over misuse of SEC funds
823,2015-12-07,CSE sets mandatory rules on Related Party Transactions
824,2015-12-07,Sri Lanka’s CSE eyes more global investors through new CCP
825,2015-12-04,Sri Lanka stocks close down 0.2-pct: Net foreign outflow
826,2015-12-04,"Sri Lanka equity earnings down 6 pct in Q3 on diversifieds, telcos: CT CLSA"
827,2015-12-03,Sri Lanka stocks close up 0.3-pct
828,2015-12-02,Sri Lanka stocks close down 0.5-pct: Institutional activity
829,2015-12-01,Single party owns 95 pct of govt securities available to foreign investors
830,2015-11-30,Sri Lanka stocks close down 0.75-pct: Near eight month low
831,2015-11-27,Stocks: Three reasons Euro area stocks are compelling
832,2015-11-27,China stocks fall 5.4 pct on brokerage probes
833,2015-11-27,Sri Lanka stocks close lower 0.04-pct: Continued loses in JKH and banks
834,2015-11-26,Sri Lanka stocks close down 0.7-pct: JKH losses
835,2015-11-26,Several IPOs slated for CSE next year
836,2015-11-26,Colombo Stock Exchange moving ahead with CCP
837,2015-11-24,Interest rates unchanged after monetary policy meeting
838,2015-11-23,Sri Lanka stocks close up 0.5-pct: Budget gains
839,2015-11-19,Sri Lanka stocks close up 0.5-pct: JKH gains
840,2015-11-19,Poll: Sri Lanka market evenly divided on possible US rate change
841,2015-11-18,Sri Lanka stocks close higher 0.06-pct: Budget concerns
842,2015-11-17,Sri Lanka stocks close up 0.2-pct: Gains in blue chips
843,2015-11-16,Sri Lanka stocks close down 0.5-pct: Banking and Telco losses
844,2015-11-16,"Analysis: Asian, Sri Lankan equities attractive on GARY valuation, says CLSA"
845,2015-11-16,Markets react to uncertainty after Paris attacks
846,2015-11-13,Sri Lanka stocks close lower 0.06-pct
847,2015-11-13,"Unusual U.S. financial market moves defy logic, say analysts"
848,2015-11-11,Sri Lanka stocks close down 0.4-pct: Banking losses  
849,2015-11-10,Sri Lanka’s Candor 5-year unit trust public offer oversubscribed
850,2015-11-10,Asian stocks open lower with stronger Fed rate hike possibility
851,2015-11-09,"Infrastructure: Negotiating position crucial in structuring deals, say experts"
852,2015-11-05,Sri Lanka stocks close up 0.2-pct: Blue chip gains  
853,2015-11-04,Sri Lanka stocks close higher 0.05-pct: Lack of policy direction  
854,2015-11-03,Sri Lanka stocks close down 0.4-pct: Turnover 14 week low
855,2015-11-02,Sri Lanka stocks close down 0.2-pct: Low investor activity
856,2015-11-02,"Interview: Three cases reopened, investigation division to expand in Nov, says SEC Chairman"
857,2015-10-29,Sri Lanka stocks close down 0.3-pct: Net foreign out flow 319mn
858,2015-10-28,Sri Lanka stocks close up 0.15-pct: Institutional buying
859,2015-10-28,Sri Lanka raises USD1.5bn in Sovereign Bond issue: report
860,2015-10-27,Sri Lanka 10-year sovereign bond gets orders over USD2.5 bn: report
861,2015-10-26,Sri Lanka stocks close flat on six week low
862,2015-10-26,"Sri Lanka growth moderating, new equilibrium on currency"
863,2015-10-23,Sri Lanka stocks close up 0.2-pct
864,2015-10-22,Sri Lanka stocks close up 0.2-pct driven by retail activity
865,2015-10-19,Sri Lanka stocks close lower 0.05-pct ahead of monetary policy review 
866,2015-10-19,PTL Watch: Bond yields edge up amid more foreign selling
867,2015-10-19,"CSE to promote Sri Lanka with Zurich, London roadshows this month"
868,2015-10-16,Poll: Central Bank expected to hold interest rates unchanged
869,2015-10-16,Sri Lanka stocks close down 0.1-pct with foreign inflow  
870,2015-10-15,Sri Lanka stocks close down 0.1-pct at three-month low
871,2015-10-14,Sri Lanka stocks close down 0.5-pct
872,2015-10-13,Sri Lanka stocks close down 0.3-pct: Budget concerns
873,2015-10-13,"Candor to list 5-year unit trust on CSE, makes public offer"
874,2015-10-12,"Sri Lanka stocks close higher 0.06-pct, Telco gains"
875,2015-10-12,"Sri Lanka has full support of WB, IMF says Finance Minister"
876,2015-10-08,"Sri Lanka stocks close flat, Net foreign out flow"
877,2015-10-08,PTL Watch: Foreign buying seen in Sri Lanka bonds
878,2015-10-07,"Sri Lanka stocks close flat, low turnover"
879,2015-10-07,PTL Watch: Tbill auction unchanged as short term bonds head north
880,2015-10-06,Sri Lanka stocks close down 0.04-pct: Banking losses
881,2015-10-06,"PTL Watch: Moderate activity, local buying matches foreign selling in bonds"
882,2015-10-05,Sri Lanka stocks close down 0.23-pct: Two week low
883,2015-10-05,"PTL Watch: Little activity, selling in 6-yr and 13-yr bonds"
884,2015-10-02,PTL Watch: Foreign outflow of USD1.15 bn from Sri Lanka govt bonds
885,2015-10-02,Sri Lanka stocks up 0.3-pct
886,2015-10-01,"Sri Lanka stocks up 0.4-pct, healthy foreign inflow"
887,2015-10-01,PTL Report: 3-Year bond rises 30 basis points
888,2015-10-01,Sri Lanka’s Bank of Ceylon debenture oversubscribed
889,2015-09-30,Sri Lanka stocks down 0.5-pct: JKH losses
890,2015-09-30,Sri Lanka’s deflation increases to 0.3 pct in Sept from 0.2 pct in Aug
891,2015-09-29,Sri Lanka stocks up 0.10-pct: Net foreign inflow
892,2015-09-28,Free flow of information vital for financial markets: CB Governor
893,2015-09-28,Colombo Stock Exchange to transform into a sustainable stock exchange
894,2015-09-28,"Sri Lanka stocks edge lower, turnover at five week high"
895,2015-09-25,Central bank holds rates unchanged; private sector credit  up 21 pct
896,2015-09-25,"Sri Lanka stocks edge lower, turnover picks up"
897,2015-09-23,Sri Lanka stocks close down 0.05-pct
898,2015-09-23,Asian stocks hit by falling commodity prices in US   
899,2015-09-22,Sri Lanka stocks close up 0.2-pct on three week high: Poultry gains
900,2015-09-22,Asian stocks rebound following gains in US and Europe  
901,2015-09-21,Sri Lanka stocks close down 0.05-pct: Low investor activity  
902,2015-09-21,Debt report: Sri Lanka market watchful after IMF comments
903,2015-09-21,"Asian markets lower on Fed intransigence, Tsipras wins Greece election"
904,2015-09-19,"Asiri Hospital to sell shares to Actis Investment, up stake in Central Hospital"
905,2015-09-18,Sri Lanka stocks close down 0.08-pct: JKH losses
906,2015-09-18,Asian stocks mixed following Fed decision to hold rates  
907,2015-09-17,"Sri Lanka can attract Japanese companies, bank: ambassador"
908,2015-09-17,Sri Lanka’s Land Rover sees growing local demand
909,2015-09-16,Sri Lanka’s Dialog increases stake in wow.lk
910,2015-09-16,Sri Lanka stocks close down 0.2-pct; Banking and finance losses following CB directive
911,2015-09-16,Bank of Japan holds rates flat despite economic contraction
912,2015-09-15,Sri Lanka stocks close down 0.14-pct: Lack of direction for investors
913,2015-09-14,Wall Street deeply divided on this week’s rate decision
914,2015-09-11,"Sri Lanka’s spending on dairy imports up 18-pct in 2014, exports drop 8-pct"
915,2015-09-11,US DOJ issues new guidelines on corporate fraud prosecution
916,2015-09-10,Sri Lanka stocks close down 0.3-pct; Asian markets lower
917,2015-09-10,China’s stock crash a direct result of authoritarian policies: Razeen Sally
918,2015-09-10,Emerging market central bankers want Fed to raise rates: report
919,2015-09-09,Sri Lanka stocks close up 0.8-pct; More retail activity
920,2015-09-09,Sri Lanka stocks open up 0.2-pct as investor sentiment changes
921,2015-09-08,Stocks close down 0.3-pct; seven week low
922,2015-09-08,"Russia’s ruble collapse tied to energy prices, volatility to continue"
923,2015-09-07,Sri Lanka stocks close down 0.9-pct
924,2015-09-07,"Orient Finance gets Central Bank approval for listing, IPO"
925,2015-09-07,"Depreciation will help some equity sectors, ease uncertainty: Bartleet Religare"
926,2015-09-04,Sri Lanka stocks close down 0.4-pct: Low investor activity
927,2015-09-03,"Sri Lanka stocks close higher 0.07-pct, net foreign outflow"
928,2015-09-03,Asian stocks up as China takes long week-end break
929,2015-09-02,Sri Lanka stocks close down 0.8-pct
930,2015-09-02,Global markets plunge on weak China factory data
931,2015-09-01,Sri Lanka stocks close down 0.1-pct: Profit taking
932,2015-09-01,Sri Lanka Markets: liquidity at Rs25 Bn; USD/LKR 134.50
933,2015-08-31,Sri Lanka stocks close down 0.6-pct: Low investor activity
934,2015-08-28,Sri Lanka stocks close up 1-pct: JKH gains
935,2015-08-27,Fitch Maintains Ceylon Income Fund on Rating Watch Negative
936,2015-08-27,"US markets rally, appears to shake off China worries"
937,2015-08-26,CHC mandatory offer for Taprobane Holdings
938,2015-08-26,"China cuts interest rates, global markets weigh move"
939,2015-08-25,Some China researchers see yuan at 7 by year end: report
940,2015-08-25,"Asian markets volatile; China extends losses, ASPI drops 1 pct"
941,2015-08-24,Stocks close down 1.9-pct amid global market uncertainty
942,2015-08-22,Stock markets fall most in 4 Years on worries about China
943,2015-08-21,Sri Lanka stocks close up 0.3-pct
944,2015-08-20,Sri Lanka stocks close down 0.6-pct
945,2015-08-17,Sri Lanka stocks close up 0.4 –pct; investors optimistic
946,2015-08-14,Sri Lanka stocks close up 0.3 -pct: CSE trading will stop at mid day on 17 Aug
947,2015-08-13,Sri Lanka stocks close down 0.4 -pct: Profit taking
948,2015-08-11,Sri Lanka stocks close up 1.2-pct
949,2015-08-10,Sri Lanka stocks close higher 0.10-pct
950,2015-08-07,Sri Lanka stocks close lower 0.09-pct
951,2015-08-05,Sri Lanka stocks close up 0.8 -pct:  Six-month high
952,2015-08-03,Sri Lanka stocks close higher 0.06-pct
953,2015-07-28,Sri Lanka stocks close up 0.2-pct
954,2015-07-27,Sri Lanka stocks close down 0.3-pct
955,2015-07-27,"China stocks plunge over 8-pct, largest intraday loss since 2007"
956,2015-07-27,Sri Lanka’s SEC says transparency of information is the key for development
957,2015-07-24,Sri Lanka stocks close up 0.8-pct
958,2015-07-24,New mobile device to access CSE trading on the go
959,2015-07-23,Sri Lankan economy expands 5.1-pct in Q1 2015 after rebasing
960,2015-07-23,Sri Lanka‘s tea exports fall for eigth consecutive month
961,2015-07-21,Sri Lanka stocks close lower 0.03-pct
962,2015-07-20,Sri Lanka stocks close down 0.2-pct
963,2015-07-17,Sri Lanka stocks close up 0.5-pct
964,2015-07-16,Sri Lanka stocks close up 0.8-pct: Two week high
965,2015-07-15,Sri Lanka stocks close up 0.6-pct: Banking gains
966,2015-07-14,Sri Lanka stocks close up 0.3-pct Turnover low
967,2015-07-12,Sri Lanka’s CSE signs MoU with Maldivian counterpart
968,2015-07-10,Sri Lanka stocks close up 0.5-pct
969,2015-07-09,Sri Lanka stocks close up 0.3-pct; JKH gains
970,2015-07-09,Fitch Ratings corrects Sri Lanka’s USD Bond at ‘BB-(EXP)’
971,2015-07-08,Sri Lanka stocks close down 0.6-pct; JKH lower
972,2015-07-08,Sri Lanka Stock Market up 15-pct by April 2015: Report
973,2015-07-07,Sri Lanka stocks close down 0.3-pct on 12 week low
974,2015-07-01,Lanka Rating Agency not entitled in law to carry on business as a Credit Rating Agency nor review ratings: SEC
975,2015-06-30,Sri Lanka North calls for private investments
976,2015-06-25,Stocks close down 0.3-pct ahead of possible polls call
977,2015-06-24,Sri Lanka stocks close flat
978,2015-06-24,SEC considers introducing a mandatory rating for stock broking firms : SEC Head
979,2015-06-23,Sri Lanka stocks close up 0.20-pct: JKH gains
980,2015-06-22,Sri Lanka stocks close higher 0.06-pct
981,2015-06-22,Sri Lanka’s state-owned enterprises in commercial business skew the market: Mano
982,2015-06-22,Watawala Plantation share purchase by T Sinthilverl
983,2015-06-19,Sri Lanka stocks close down 0.4-pct : Telcos make losses
984,2015-06-18,Stocks close up 0.2 pct; JKH makes gains
985,2015-06-17,Sri Lanka stocks close higher 0.07-pct: Nestle declines 9-pct in June
986,2015-06-16,Sri Lanka stocks close down 0.5-pct: JKH recording losses
987,2015-06-16,Sri Lanka securities regulator to allow short selling in equity markets
988,2015-06-15,Sri Lanka stocks close up 0.3-pct for second straight day
989,2015-06-12,Sri Lanka stocks close up 0.1-pct following four days of losses
990,2015-06-11,Sri Lanka stocks close down 0.2-pct; Foreigners net sellers
